{
  "$schema":"https://json-schema.org/draft/2020-12/schema","$id":"https://github.com/shumkiiv/hausmanhub-contracts/schemas/v1/scenario-node-red-decision.schema.json","title":"HausmanHub Node-RED decision v1","type":"object","additionalProperties":false,
  "required":["contract","correlationId","scenarioId","planId","controllerVersion","settingsRevision","baseRevision","snapshotRevision","observationEpoch","expiresAtMs","status","reasonCode","trace","nextState","wakeups","action"],
  "$defs":{"id":{"type":"string","pattern":"^[A-Za-z0-9][A-Za-z0-9._:-]{0,127}$"},"safe":{"type":"integer","minimum":0,"maximum":9007199254740991},"wakeup":{"type":"object","additionalProperties":false,"required":["id","kind","dueAtMs"],"properties":{"id":{"$ref":"#/$defs/id"},"kind":{"enum":["profile","absence","fade","mirror","hold"]},"dueAtMs":{"$ref":"#/$defs/safe"}}}},
  "properties":{"contract":{"type":"object","additionalProperties":false,"required":["name","version"],"properties":{"name":{"const":"hausman-node-red-decision"},"version":{"const":1}}},"correlationId":{"$ref":"#/$defs/id"},"scenarioId":{"type":"string","pattern":"^[a-z][a-z0-9_-]{0,63}$"},"planId":{"$ref":"#/$defs/id"},"controllerVersion":{"const":1},"settingsRevision":{"$ref":"#/$defs/safe"},"baseRevision":{"$ref":"#/$defs/safe"},"snapshotRevision":{"$ref":"#/$defs/safe"},"observationEpoch":{"$ref":"#/$defs/safe"},"expiresAtMs":{"$ref":"#/$defs/safe"},"status":{"enum":["decided","skipped"]},"reasonCode":{"type":"string","minLength":1,"maxLength":120},"trace":{"type":"array","maxItems":64,"items":{"$ref":"scenario-node-red-execution.schema.json#/properties/trace/items"}},"nextState":{"type":"object","additionalProperties":false,"required":["phase","phaseStartedAtMs","absenceSinceMs","absenceEpoch","fadeStartPercent","fadeStartedAtMs","fadeReason"],"properties":{"phase":{"enum":["idle","occupied","absent","fade","mirror_handover","night","blocked"]},"phaseStartedAtMs":{"type":["integer","null"],"minimum":0,"maximum":9007199254740991},"absenceSinceMs":{"type":["integer","null"],"minimum":0,"maximum":9007199254740991},"absenceEpoch":{"type":["integer","null"],"minimum":0,"maximum":9007199254740991},"fadeStartPercent":{"type":["integer","null"],"minimum":0,"maximum":100},"fadeStartedAtMs":{"type":["integer","null"],"minimum":0,"maximum":9007199254740991},"fadeReason":{"enum":[null,"absence","night"]}}},"wakeups":{"type":"array","maxItems":4,"items":{"$ref":"#/$defs/wakeup"}},"action":{"oneOf":[{"type":"null"},{"type":"object","additionalProperties":false,"required":["id","targetId","actionId","authorityGeneration","observedRevision"],"properties":{"id":{"$ref":"#/$defs/id"},"targetId":{"$ref":"#/$defs/id"},"actionId":{"enum":["turn_on","turn_off","set_brightness_percent","set_color_temperature"]},"value":{"type":"integer","minimum":0,"maximum":10000},"authorityGeneration":{"$ref":"#/$defs/safe"},"observedRevision":{"$ref":"#/$defs/safe"}},"allOf":[{"if":{"properties":{"actionId":{"enum":["turn_on","turn_off"]}}},"then":{"not":{"required":["value"]}}},{"if":{"properties":{"actionId":{"const":"set_brightness_percent"}}},"then":{"properties":{"value":{"type":"integer","minimum":0,"maximum":100}},"required":["value"]}},{"if":{"properties":{"actionId":{"const":"set_color_temperature"}}},"then":{"properties":{"value":{"type":"integer","minimum":1500,"maximum":10000}},"required":["value"]}}]}]}}
}
