{"contract":{"name":"hausman-node-red-decision","version":1},"correlationId":"tambur.night.1","scenarioId":"tambur_adaptive_light","planId":"plan.night.1","controllerVersion":1,"settingsRevision":7,"baseRevision":13,"snapshotRevision":35,"observationEpoch":4,"expiresAtMs":1800000460000,"status":"decided","reasonCode":"mirror_handover_retry","trace":[{"id":"mirror","title":"Зеркало не подтвердило включение","status":"failed"}],"nextState":{"phase":"mirror_handover","phaseStartedAtMs":1800000400000,"absenceSinceMs":null,"absenceEpoch":null,"fadeStartPercent":null,"fadeStartedAtMs":null,"fadeReason":"night"},"wakeups":[{"id":"mirror.retry.1","kind":"mirror","dueAtMs":1800000410000}],"action":{"id":"action.mirror.1","targetId":"lamp_mirror_demo","actionId":"turn_on","authorityGeneration":9,"observedRevision":20}}
