{"contract":{"name":"hausman-node-red-decision","version":1},"correlationId":"tambur.protection.1","scenarioId":"tambur_adaptive_light","planId":"plan.protection.1","controllerVersion":1,"settingsRevision":7,"baseRevision":12,"snapshotRevision":34,"observationEpoch":4,"expiresAtMs":1800000360000,"status":"skipped","reasonCode":"manual_off_protection","trace":[],"nextState":{"phase":"blocked","phaseStartedAtMs":1800000300000,"absenceSinceMs":null,"absenceEpoch":null,"fadeStartPercent":null,"fadeStartedAtMs":null,"fadeReason":null},"wakeups":[{"id":"hold.hour.1","kind":"hold","dueAtMs":1800000900000}],"action":null}
