{"contract":{"name":"hausman-node-red-decision","version":1},"correlationId":"tambur.day.1","scenarioId":"tambur_adaptive_light","planId":"plan.day.1","controllerVersion":1,"settingsRevision":7,"baseRevision":9,"snapshotRevision":31,"observationEpoch":4,"expiresAtMs":1800000060000,"status":"decided","reasonCode":"presence_day","trace":[{"id":"presence","title":"Присутствие подтверждено","status":"passed"}],"nextState":{"phase":"occupied","phaseStartedAtMs":1800000000000,"absenceSinceMs":null,"absenceEpoch":null,"fadeStartPercent":null,"fadeStartedAtMs":null,"fadeReason":null},"wakeups":[],"action":{"id":"action.day.1","targetId":"lamp_chandelier_demo","actionId":"set_brightness_percent","value":60,"authorityGeneration":2,"observedRevision":11}}
