{"contract":{"name":"hausman-node-red-decision","version":1},"correlationId":"tambur.absence.1","scenarioId":"tambur_adaptive_light","planId":"plan.absence.1","controllerVersion":1,"settingsRevision":7,"baseRevision":11,"snapshotRevision":33,"observationEpoch":4,"expiresAtMs":1800000260000,"status":"skipped","reasonCode":"absence_waiting","trace":[],"nextState":{"phase":"absent","phaseStartedAtMs":1800000190000,"absenceSinceMs":1800000190000,"absenceEpoch":4,"fadeStartPercent":null,"fadeStartedAtMs":null,"fadeReason":null},"wakeups":[{"id":"absence.due.1","kind":"absence","dueAtMs":1800000250000}],"action":null}
