{"contract":{"name":"hausman-node-red-decision","version":1},"correlationId":"tambur.manual.1","scenarioId":"tambur_adaptive_light","planId":"plan.manual.1","controllerVersion":1,"settingsRevision":7,"baseRevision":10,"snapshotRevision":32,"observationEpoch":4,"expiresAtMs":1800000160000,"status":"decided","reasonCode":"manual_chandelier_points_allowed","trace":[{"id":"manual","title":"Люстра включена вручную","status":"skipped"}],"nextState":{"phase":"occupied","phaseStartedAtMs":1800000100000,"absenceSinceMs":null,"absenceEpoch":null,"fadeStartPercent":null,"fadeStartedAtMs":null,"fadeReason":null},"wakeups":[],"action":{"id":"action.manual.1","targetId":"lamp_points_demo","actionId":"turn_on","authorityGeneration":3,"observedRevision":15}}
