{"contract":{"name":"hausman-node-red-decision","version":1},"correlationId":"tambur.recovery.1","scenarioId":"tambur_adaptive_light","planId":"plan.recovery.1","controllerVersion":1,"settingsRevision":7,"baseRevision":14,"snapshotRevision":36,"observationEpoch":5,"expiresAtMs":1800000560000,"status":"skipped","reasonCode":"recovery_absence_restarted","trace":[],"nextState":{"phase":"occupied","phaseStartedAtMs":1800000500000,"absenceSinceMs":null,"absenceEpoch":null,"fadeStartPercent":null,"fadeStartedAtMs":null,"fadeReason":null},"wakeups":[],"action":null}
